2025-12-14 17:18:36 | INFO     | Using device: cuda
2025-12-14 17:18:36 | INFO     | 
============================================================
2025-12-14 17:18:36 | INFO     | Loading data...
2025-12-14 17:18:36 | INFO     | ============================================================
2025-12-14 17:18:36 | INFO     | Loaded data: X=(504, 256, 4), Y=(504, 256)
2025-12-14 17:18:36 | INFO     | Augmented: 504 train samples
2025-12-14 17:18:36 | INFO     | 
============================================================
2025-12-14 17:18:36 | INFO     | Starting Hierarchical Bayesian Optimization (100 trials)
2025-12-14 17:18:36 | INFO     | ============================================================
[I 2025-12-14 17:18:36,046] A new study created in memory with name: hierarchical_bayesian_optimization
Original samples per class:
  Class 0: 0
  Class 1: 84
  Class 2: 84
  Class 3: 84
  Class 4: 84
  Class 5: 84
  Class 6: 84

Target samples per pattern class: 84

Balanced dataset: 504 samples (was 504)
  0%|          | 0/100 [00:00<?, ?it/s]                                         0%|          | 0/100 [00:26<?, ?it/s]Best trial: 0. Best value: 0.747285:   0%|          | 0/100 [00:26<?, ?it/s]Best trial: 0. Best value: 0.747285:   1%|          | 1/100 [00:26<43:12, 26.19s/it]                                                                                    Best trial: 0. Best value: 0.747285:   1%|          | 1/100 [00:32<43:12, 26.19s/it]Best trial: 0. Best value: 0.747285:   1%|          | 1/100 [00:32<43:12, 26.19s/it]Best trial: 0. Best value: 0.747285:   2%|▏         | 2/100 [00:32<24:03, 14.73s/it]                                                                                    Best trial: 0. Best value: 0.747285:   2%|▏         | 2/100 [00:37<24:03, 14.73s/it]Best trial: 0. Best value: 0.747285:   2%|▏         | 2/100 [00:37<24:03, 14.73s/it]Best trial: 0. Best value: 0.747285:   3%|▎         | 3/100 [00:37<16:40, 10.31s/it]                                                                                    Best trial: 0. Best value: 0.747285:   3%|▎         | 3/100 [00:56<16:40, 10.31s/it]Best trial: 0. Best value: 0.747285:   3%|▎         | 3/100 [00:56<16:40, 10.31s/it]Best trial: 0. Best value: 0.747285:   4%|▍         | 4/100 [00:56<21:57, 13.72s/it]                                                                                    Best trial: 0. Best value: 0.747285:   4%|▍         | 4/100 [01:06<21:57, 13.72s/it]Best trial: 4. Best value: 0.755641:   4%|▍         | 4/100 [01:06<21:57, 13.72s/it]Best trial: 4. Best value: 0.755641:   5%|▌         | 5/100 [01:06<19:21, 12.23s/it]                                                                                    Best trial: 4. Best value: 0.755641:   5%|▌         | 5/100 [01:10<19:21, 12.23s/it]Best trial: 4. Best value: 0.755641:   5%|▌         | 5/100 [01:10<19:21, 12.23s/it]Best trial: 4. Best value: 0.755641:   6%|▌         | 6/100 [01:10<14:39,  9.36s/it]                                                                                    Best trial: 4. Best value: 0.755641:   6%|▌         | 6/100 [01:12<14:39,  9.36s/it]Best trial: 4. Best value: 0.755641:   6%|▌         | 6/100 [01:12<14:39,  9.36s/it]Best trial: 4. Best value: 0.755641:   7%|▋         | 7/100 [01:12<11:06,  7.16s/it]                                                                                    Best trial: 4. Best value: 0.755641:   7%|▋         | 7/100 [01:15<11:06,  7.16s/it]Best trial: 4. Best value: 0.755641:   7%|▋         | 7/100 [01:15<11:06,  7.16s/it]Best trial: 4. Best value: 0.755641:   8%|▊         | 8/100 [01:15<08:59,  5.86s/it]                                                                                    Best trial: 4. Best value: 0.755641:   8%|▊         | 8/100 [01:19<08:59,  5.86s/it]Best trial: 4. Best value: 0.755641:   8%|▊         | 8/100 [01:19<08:59,  5.86s/it]Best trial: 4. Best value: 0.755641:   9%|▉         | 9/100 [01:19<07:51,  5.18s/it]                                                                                    Best trial: 4. Best value: 0.755641:   9%|▉         | 9/100 [01:20<07:51,  5.18s/it]Best trial: 4. Best value: 0.755641:   9%|▉         | 9/100 [01:21<07:51,  5.18s/it]Best trial: 4. Best value: 0.755641:  10%|█         | 10/100 [01:21<06:01,  4.01s/it]                                                                                     Best trial: 4. Best value: 0.755641:  10%|█         | 10/100 [01:35<06:01,  4.01s/it]Best trial: 4. Best value: 0.755641:  10%|█         | 10/100 [01:35<06:01,  4.01s/it]Best trial: 4. Best value: 0.755641:  11%|█         | 11/100 [01:35<10:33,  7.12s/it]                                                                                     Best trial: 4. Best value: 0.755641:  11%|█         | 11/100 [01:49<10:33,  7.12s/it]Best trial: 4. Best value: 0.755641:  11%|█         | 11/100 [01:49<10:33,  7.12s/it]Best trial: 4. Best value: 0.755641:  12%|█▏        | 12/100 [01:49<13:29,  9.20s/it]                                                                                     Best trial: 4. Best value: 0.755641:  12%|█▏        | 12/100 [01:53<13:29,  9.20s/it]Best trial: 4. Best value: 0.755641:  12%|█▏        | 12/100 [01:53<13:29,  9.20s/it]Best trial: 4. Best value: 0.755641:  13%|█▎        | 13/100 [01:53<11:23,  7.85s/it]                                                                                     Best trial: 4. Best value: 0.755641:  13%|█▎        | 13/100 [02:19<11:23,  7.85s/it]Best trial: 13. Best value: 0.757835:  13%|█▎        | 13/100 [02:19<11:23,  7.85s/it]Best trial: 13. Best value: 0.757835:  14%|█▍        | 14/100 [02:19<19:07, 13.34s/it]                                                                                      Best trial: 13. Best value: 0.757835:  14%|█▍        | 14/100 [02:29<19:07, 13.34s/it]Best trial: 13. Best value: 0.757835:  14%|█▍        | 14/100 [02:29<19:07, 13.34s/it]Best trial: 13. Best value: 0.757835:  15%|█▌        | 15/100 [02:29<17:19, 12.22s/it]                                                                                      Best trial: 13. Best value: 0.757835:  15%|█▌        | 15/100 [02:52<17:19, 12.22s/it]Best trial: 13. Best value: 0.757835:  15%|█▌        | 15/100 [02:52<17:19, 12.22s/it]Best trial: 13. Best value: 0.757835:  16%|█▌        | 16/100 [02:52<21:39, 15.46s/it]                                                                                      Best trial: 13. Best value: 0.757835:  16%|█▌        | 16/100 [03:09<21:39, 15.46s/it]Best trial: 13. Best value: 0.757835:  16%|█▌        | 16/100 [03:09<21:39, 15.46s/it]Best trial: 13. Best value: 0.757835:  17%|█▋        | 17/100 [03:09<22:04, 15.95s/it]                                                                                      Best trial: 13. Best value: 0.757835:  17%|█▋        | 17/100 [03:16<22:04, 15.95s/it]Best trial: 13. Best value: 0.757835:  17%|█▋        | 17/100 [03:16<22:04, 15.95s/it]Best trial: 13. Best value: 0.757835:  18%|█▊        | 18/100 [03:16<18:02, 13.20s/it]                                                                                      Best trial: 13. Best value: 0.757835:  18%|█▊        | 18/100 [03:27<18:02, 13.20s/it]Best trial: 13. Best value: 0.757835:  18%|█▊        | 18/100 [03:27<18:02, 13.20s/it]Best trial: 13. Best value: 0.757835:  19%|█▉        | 19/100 [03:27<16:51, 12.49s/it]                                                                                      Best trial: 13. Best value: 0.757835:  19%|█▉        | 19/100 [03:28<16:51, 12.49s/it]Best trial: 13. Best value: 0.757835:  19%|█▉        | 19/100 [03:28<16:51, 12.49s/it]Best trial: 13. Best value: 0.757835:  20%|██        | 20/100 [03:28<12:19,  9.24s/it]                                                                                      Best trial: 13. Best value: 0.757835:  20%|██        | 20/100 [03:37<12:19,  9.24s/it]Best trial: 13. Best value: 0.757835:  20%|██        | 20/100 [03:37<12:19,  9.24s/it]Best trial: 13. Best value: 0.757835:  21%|██        | 21/100 [03:37<11:53,  9.03s/it]                                                                                      Best trial: 13. Best value: 0.757835:  21%|██        | 21/100 [03:44<11:53,  9.03s/it]Best trial: 13. Best value: 0.757835:  21%|██        | 21/100 [03:44<11:53,  9.03s/it]Best trial: 13. Best value: 0.757835:  22%|██▏       | 22/100 [03:44<11:01,  8.48s/it]                                                                                      Best trial: 13. Best value: 0.757835:  22%|██▏       | 22/100 [04:05<11:01,  8.48s/it]Best trial: 13. Best value: 0.757835:  22%|██▏       | 22/100 [04:05<11:01,  8.48s/it]Best trial: 13. Best value: 0.757835:  23%|██▎       | 23/100 [04:05<15:36, 12.16s/it]                                                                                      Best trial: 13. Best value: 0.757835:  23%|██▎       | 23/100 [04:47<15:36, 12.16s/it]Best trial: 13. Best value: 0.757835:  23%|██▎       | 23/100 [04:47<15:36, 12.16s/it]Best trial: 13. Best value: 0.757835:  24%|██▍       | 24/100 [04:47<26:45, 21.12s/it]                                                                                      Best trial: 13. Best value: 0.757835:  24%|██▍       | 24/100 [04:59<26:45, 21.12s/it]Best trial: 13. Best value: 0.757835:  24%|██▍       | 24/100 [04:59<26:45, 21.12s/it]Best trial: 13. Best value: 0.757835:  25%|██▌       | 25/100 [04:59<23:00, 18.41s/it]                                                                                      Best trial: 13. Best value: 0.757835:  25%|██▌       | 25/100 [05:13<23:00, 18.41s/it]Best trial: 13. Best value: 0.757835:  25%|██▌       | 25/100 [05:13<23:00, 18.41s/it]Best trial: 13. Best value: 0.757835:  26%|██▌       | 26/100 [05:13<21:09, 17.16s/it]                                                                                      Best trial: 13. Best value: 0.757835:  26%|██▌       | 26/100 [05:18<21:09, 17.16s/it]Best trial: 13. Best value: 0.757835:  26%|██▌       | 26/100 [05:18<21:09, 17.16s/it]Best trial: 13. Best value: 0.757835:  27%|██▋       | 27/100 [05:18<16:21, 13.45s/it]                                                                                      Best trial: 13. Best value: 0.757835:  27%|██▋       | 27/100 [05:29<16:21, 13.45s/it]Best trial: 13. Best value: 0.757835:  27%|██▋       | 27/100 [05:29<16:21, 13.45s/it]Best trial: 13. Best value: 0.757835:  28%|██▊       | 28/100 [05:29<15:19, 12.77s/it]                                                                                      Best trial: 13. Best value: 0.757835:  28%|██▊       | 28/100 [05:32<15:19, 12.77s/it]Best trial: 13. Best value: 0.757835:  28%|██▊       | 28/100 [05:32<15:19, 12.77s/it]Best trial: 13. Best value: 0.757835:  29%|██▉       | 29/100 [05:32<11:40,  9.87s/it]                                                                                      Best trial: 13. Best value: 0.757835:  29%|██▉       | 29/100 [05:37<11:40,  9.87s/it]Best trial: 13. Best value: 0.757835:  29%|██▉       | 29/100 [05:37<11:40,  9.87s/it]Best trial: 13. Best value: 0.757835:  30%|███       | 30/100 [05:37<09:48,  8.41s/it]                                                                                      Best trial: 13. Best value: 0.757835:  30%|███       | 30/100 [05:48<09:48,  8.41s/it]Best trial: 13. Best value: 0.757835:  30%|███       | 30/100 [05:48<09:48,  8.41s/it]Best trial: 13. Best value: 0.757835:  31%|███       | 31/100 [05:48<10:26,  9.08s/it]                                                                                      Best trial: 13. Best value: 0.757835:  31%|███       | 31/100 [05:53<10:26,  9.08s/it]Best trial: 13. Best value: 0.757835:  31%|███       | 31/100 [05:53<10:26,  9.08s/it]Best trial: 13. Best value: 0.757835:  32%|███▏      | 32/100 [05:53<09:02,  7.98s/it]                                                                                      [I 2025-12-14 17:19:02,077] Trial 0 finished with value: 0.7472854183586685 and parameters: {'learning_rate': 0.0002805758207667253, 'weight_decay': 0.006351221010640704, 'batch_size': 8, 'scheduler': 'step', 'grad_clip': 3.0, 's1_hidden_size': 64, 's1_num_layers': 1, 's1_dropout': 0.30000000000000004, 's1_bidirectional': True, 's2_hidden_size': 64, 's2_num_layers': 2, 's2_dropout': 0.45000000000000007, 's2_bidirectional': False, 'use_class_weights': True, 'class_weight_scale': 0.8}. Best is trial 0 with value: 0.7472854183586685.
[I 2025-12-14 17:19:08,804] Trial 1 finished with value: 0.7279751952490051 and parameters: {'learning_rate': 0.0001096524277832185, 'weight_decay': 1.8205657658407268e-06, 'batch_size': 16, 'scheduler': 'step', 'grad_clip': 2.0, 's1_hidden_size': 64, 's1_num_layers': 2, 's1_dropout': 0.30000000000000004, 's1_bidirectional': False, 's2_hidden_size': 96, 's2_num_layers': 3, 's2_dropout': 0.1, 's2_bidirectional': True, 'use_class_weights': False}. Best is trial 0 with value: 0.7472854183586685.
[I 2025-12-14 17:19:13,861] Trial 2 finished with value: 0.7472589188940107 and parameters: {'learning_rate': 0.0001744488327445185, 'weight_decay': 0.0020651425578959264, 'batch_size': 32, 'scheduler': 'one_cycle', 'grad_clip': 0.5, 's1_hidden_size': 64, 's1_num_layers': 1, 's1_dropout': 0.25, 's1_bidirectional': False, 's2_hidden_size': 64, 's2_num_layers': 1, 's2_dropout': 0.4, 's2_bidirectional': False, 'use_class_weights': True, 'class_weight_scale': 0.8}. Best is trial 0 with value: 0.7472854183586685.
[I 2025-12-14 17:19:32,816] Trial 3 finished with value: 0.7457291152307268 and parameters: {'learning_rate': 0.001661652103113397, 'weight_decay': 0.0001758364027000851, 'batch_size': 8, 'scheduler': 'cosine', 'grad_clip': 1.0, 's1_hidden_size': 64, 's1_num_layers': 1, 's1_dropout': 0.1, 's1_bidirectional': True, 's2_hidden_size': 64, 's2_num_layers': 3, 's2_dropout': 0.15000000000000002, 's2_bidirectional': True, 'use_class_weights': False}. Best is trial 0 with value: 0.7472854183586685.
[I 2025-12-14 17:19:42,416] Trial 4 finished with value: 0.7556407758392621 and parameters: {'learning_rate': 0.0002162603762693266, 'weight_decay': 2.7555462077796614e-06, 'batch_size': 32, 'scheduler': 'cosine', 'grad_clip': 0.5, 's1_hidden_size': 64, 's1_num_layers': 2, 's1_dropout': 0.5, 's1_bidirectional': True, 's2_hidden_size': 64, 's2_num_layers': 2, 's2_dropout': 0.30000000000000004, 's2_bidirectional': False, 'use_class_weights': True, 'class_weight_scale': 0.2}. Best is trial 4 with value: 0.7556407758392621.
[I 2025-12-14 17:19:46,185] Trial 5 pruned. 
[I 2025-12-14 17:19:48,828] Trial 6 pruned. 
[I 2025-12-14 17:19:51,910] Trial 7 pruned. 
[I 2025-12-14 17:19:55,570] Trial 8 pruned. 
[I 2025-12-14 17:19:56,945] Trial 9 pruned. 
[I 2025-12-14 17:20:11,139] Trial 10 pruned. 
[I 2025-12-14 17:20:25,084] Trial 11 pruned. 
[I 2025-12-14 17:20:29,820] Trial 12 pruned. 
[I 2025-12-14 17:20:55,862] Trial 13 finished with value: 0.7578354045595219 and parameters: {'learning_rate': 0.0008439170174804815, 'weight_decay': 0.00975195345608243, 'batch_size': 32, 'scheduler': 'cosine', 'grad_clip': 2.0, 's1_hidden_size': 192, 's1_num_layers': 1, 's1_dropout': 0.45000000000000007, 's1_bidirectional': True, 's2_hidden_size': 64, 's2_num_layers': 2, 's2_dropout': 0.25, 's2_bidirectional': False, 'use_class_weights': True, 'class_weight_scale': 0.6000000000000001}. Best is trial 13 with value: 0.7578354045595219.
[I 2025-12-14 17:21:05,488] Trial 14 finished with value: 0.7485262819324076 and parameters: {'learning_rate': 0.0010310046238005506, 'weight_decay': 6.496803210755688e-06, 'batch_size': 32, 'scheduler': 'cosine', 'grad_clip': 2.0, 's1_hidden_size': 192, 's1_num_layers': 1, 's1_dropout': 0.45000000000000007, 's1_bidirectional': True, 's2_hidden_size': 64, 's2_num_layers': 1, 's2_dropout': 0.25, 's2_bidirectional': True, 'use_class_weights': True, 'class_weight_scale': 0.4}. Best is trial 13 with value: 0.7578354045595219.
[I 2025-12-14 17:21:28,486] Trial 15 finished with value: 0.7498324714154274 and parameters: {'learning_rate': 0.0008415745760042471, 'weight_decay': 0.0001565294159768137, 'batch_size': 32, 'scheduler': 'cosine', 'grad_clip': 2.0, 's1_hidden_size': 192, 's1_num_layers': 2, 's1_dropout': 0.45000000000000007, 's1_bidirectional': True, 's2_hidden_size': 64, 's2_num_layers': 2, 's2_dropout': 0.25, 's2_bidirectional': False, 'use_class_weights': True, 'class_weight_scale': 0.4}. Best is trial 13 with value: 0.7578354045595219.
[I 2025-12-14 17:21:45,593] Trial 16 finished with value: 0.7391097071929583 and parameters: {'learning_rate': 0.0005789826117422937, 'weight_decay': 0.001279924106485134, 'batch_size': 32, 'scheduler': 'cosine', 'grad_clip': 0.5, 's1_hidden_size': 192, 's1_num_layers': 2, 's1_dropout': 0.5, 's1_bidirectional': True, 's2_hidden_size': 96, 's2_num_layers': 3, 's2_dropout': 0.35, 's2_bidirectional': False, 'use_class_weights': True, 'class_weight_scale': 0.6000000000000001}. Best is trial 13 with value: 0.7578354045595219.
[I 2025-12-14 17:21:52,363] Trial 17 pruned. 
[I 2025-12-14 17:22:03,214] Trial 18 finished with value: 0.7441916032685316 and parameters: {'learning_rate': 0.0006650327619387312, 'weight_decay': 2.784147615336211e-05, 'batch_size': 32, 'scheduler': 'cosine', 'grad_clip': 0.5, 's1_hidden_size': 128, 's1_num_layers': 1, 's1_dropout': 0.45000000000000007, 's1_bidirectional': True, 's2_hidden_size': 128, 's2_num_layers': 3, 's2_dropout': 0.35, 's2_bidirectional': True, 'use_class_weights': False}. Best is trial 13 with value: 0.7578354045595219.
[I 2025-12-14 17:22:04,883] Trial 19 pruned. 
[I 2025-12-14 17:22:13,433] Trial 20 pruned. 
[I 2025-12-14 17:22:20,612] Trial 21 pruned. 
[I 2025-12-14 17:22:41,352] Trial 22 finished with value: 0.7477780734464007 and parameters: {'learning_rate': 0.0007933271800628208, 'weight_decay': 1.6958901229250484e-05, 'batch_size': 32, 'scheduler': 'cosine', 'grad_clip': 2.0, 's1_hidden_size': 192, 's1_num_layers': 2, 's1_dropout': 0.45000000000000007, 's1_bidirectional': True, 's2_hidden_size': 64, 's2_num_layers': 2, 's2_dropout': 0.2, 's2_bidirectional': False, 'use_class_weights': True, 'class_weight_scale': 0.4}. Best is trial 13 with value: 0.7578354045595219.
[I 2025-12-14 17:23:23,392] Trial 23 pruned. 
[I 2025-12-14 17:23:35,475] Trial 24 pruned. 
[I 2025-12-14 17:23:49,711] Trial 25 finished with value: 0.7362728781060445 and parameters: {'learning_rate': 0.0013088564408577196, 'weight_decay': 0.0034188474494807075, 'batch_size': 32, 'scheduler': 'cosine', 'grad_clip': 2.0, 's1_hidden_size': 192, 's1_num_layers': 2, 's1_dropout': 0.35, 's1_bidirectional': True, 's2_hidden_size': 64, 's2_num_layers': 2, 's2_dropout': 0.2, 's2_bidirectional': False, 'use_class_weights': True, 'class_weight_scale': 0.6000000000000001}. Best is trial 13 with value: 0.7578354045595219.
[I 2025-12-14 17:23:54,489] Trial 26 pruned. 
[I 2025-12-14 17:24:05,659] Trial 27 finished with value: 0.7527742786974791 and parameters: {'learning_rate': 0.00026453458573315206, 'weight_decay': 0.00020111441319119956, 'batch_size': 32, 'scheduler': 'cosine', 'grad_clip': 0.5, 's1_hidden_size': 128, 's1_num_layers': 2, 's1_dropout': 0.45000000000000007, 's1_bidirectional': True, 's2_hidden_size': 192, 's2_num_layers': 1, 's2_dropout': 0.15000000000000002, 's2_bidirectional': False, 'use_class_weights': True, 'class_weight_scale': 0.2}. Best is trial 13 with value: 0.7578354045595219.
[I 2025-12-14 17:24:08,790] Trial 28 pruned. 
[I 2025-12-14 17:24:13,799] Trial 29 pruned. 
[I 2025-12-14 17:24:24,421] Trial 30 finished with value: 0.7368925308014699 and parameters: {'learning_rate': 0.00032847830152210394, 'weight_decay': 1.6598774283161075e-05, 'batch_size': 8, 'scheduler': 'step', 'grad_clip': 0.5, 's1_hidden_size': 128, 's1_num_layers': 1, 's1_dropout': 0.35, 's1_bidirectional': True, 's2_hidden_size': 192, 's2_num_layers': 1, 's2_dropout': 0.15000000000000002, 's2_bidirectional': False, 'use_class_weights': True, 'class_weight_scale': 0.2}. Best is trial 13 with value: 0.7578354045595219.
[I 2025-12-14 17:24:29,840] Trial 31 pruned. 
[I 2025-12-14 17:24:31,961] Trial 32 pruned. Best trial: 13. Best value: 0.757835:  32%|███▏      | 32/100 [05:55<09:02,  7.98s/it]Best trial: 13. Best value: 0.757835:  32%|███▏      | 32/100 [05:56<09:02,  7.98s/it]Best trial: 13. Best value: 0.757835:  33%|███▎      | 33/100 [05:56<06:56,  6.22s/it]                                                                                      Best trial: 13. Best value: 0.757835:  33%|███▎      | 33/100 [05:59<06:56,  6.22s/it]Best trial: 13. Best value: 0.757835:  33%|███▎      | 33/100 [05:59<06:56,  6.22s/it]Best trial: 13. Best value: 0.757835:  34%|███▍      | 34/100 [05:59<05:57,  5.41s/it]                                                                                      Best trial: 13. Best value: 0.757835:  34%|███▍      | 34/100 [06:00<05:57,  5.41s/it]Best trial: 13. Best value: 0.757835:  34%|███▍      | 34/100 [06:00<05:57,  5.41s/it]Best trial: 13. Best value: 0.757835:  35%|███▌      | 35/100 [06:00<04:32,  4.20s/it]                                                                                      Best trial: 13. Best value: 0.757835:  35%|███▌      | 35/100 [06:02<04:32,  4.20s/it]Best trial: 13. Best value: 0.757835:  35%|███▌      | 35/100 [06:02<04:32,  4.20s/it]Best trial: 13. Best value: 0.757835:  36%|███▌      | 36/100 [06:02<03:34,  3.35s/it]                                                                                      Best trial: 13. Best value: 0.757835:  36%|███▌      | 36/100 [06:05<03:34,  3.35s/it]Best trial: 13. Best value: 0.757835:  36%|███▌      | 36/100 [06:05<03:34,  3.35s/it]Best trial: 13. Best value: 0.757835:  37%|███▋      | 37/100 [06:05<03:31,  3.36s/it]                                                                                      Best trial: 13. Best value: 0.757835:  37%|███▋      | 37/100 [06:06<03:31,  3.36s/it]Best trial: 13. Best value: 0.757835:  37%|███▋      | 37/100 [06:06<03:31,  3.36s/it]Best trial: 13. Best value: 0.757835:  38%|███▊      | 38/100 [06:06<02:49,  2.73s/it]                                                                                      Best trial: 13. Best value: 0.757835:  38%|███▊      | 38/100 [06:08<02:49,  2.73s/it]Best trial: 13. Best value: 0.757835:  38%|███▊      | 38/100 [06:08<02:49,  2.73s/it]Best trial: 13. Best value: 0.757835:  39%|███▉      | 39/100 [06:08<02:22,  2.34s/it]                                                                                      Best trial: 13. Best value: 0.757835:  39%|███▉      | 39/100 [06:17<02:22,  2.34s/it]Best trial: 13. Best value: 0.757835:  39%|███▉      | 39/100 [06:17<02:22,  2.34s/it]Best trial: 13. Best value: 0.757835:  40%|████      | 40/100 [06:17<04:20,  4.34s/it]                                                                                      Best trial: 13. Best value: 0.757835:  40%|████      | 40/100 [06:25<04:20,  4.34s/it]Best trial: 13. Best value: 0.757835:  40%|████      | 40/100 [06:25<04:20,  4.34s/it]Best trial: 13. Best value: 0.757835:  41%|████      | 41/100 [06:25<05:17,  5.39s/it]                                                                                      Best trial: 13. Best value: 0.757835:  41%|████      | 41/100 [06:27<05:17,  5.39s/it]Best trial: 13. Best value: 0.757835:  41%|████      | 41/100 [06:27<05:17,  5.39s/it]Best trial: 13. Best value: 0.757835:  42%|████▏     | 42/100 [06:27<04:21,  4.51s/it]                                                                                      Best trial: 13. Best value: 0.757835:  42%|████▏     | 42/100 [06:50<04:21,  4.51s/it]Best trial: 13. Best value: 0.757835:  42%|████▏     | 42/100 [06:50<04:21,  4.51s/it]Best trial: 13. Best value: 0.757835:  43%|████▎     | 43/100 [06:50<09:34, 10.07s/it]                                                                                      Best trial: 13. Best value: 0.757835:  43%|████▎     | 43/100 [06:52<09:34, 10.07s/it]Best trial: 13. Best value: 0.757835:  43%|████▎     | 43/100 [06:52<09:34, 10.07s/it]Best trial: 13. Best value: 0.757835:  44%|████▍     | 44/100 [06:52<07:01,  7.53s/it]                                                                                      Best trial: 13. Best value: 0.757835:  44%|████▍     | 44/100 [07:42<07:01,  7.53s/it]Best trial: 44. Best value: 0.758811:  44%|████▍     | 44/100 [07:42<07:01,  7.53s/it]Best trial: 44. Best value: 0.758811:  45%|████▌     | 45/100 [07:42<18:40, 20.37s/it]                                                                                      Best trial: 44. Best value: 0.758811:  45%|████▌     | 45/100 [07:44<18:40, 20.37s/it]Best trial: 44. Best value: 0.758811:  45%|████▌     | 45/100 [07:44<18:40, 20.37s/it]Best trial: 44. Best value: 0.758811:  46%|████▌     | 46/100 [07:44<13:14, 14.72s/it]                                                                                      Best trial: 44. Best value: 0.758811:  46%|████▌     | 46/100 [07:57<13:14, 14.72s/it]Best trial: 44. Best value: 0.758811:  46%|████▌     | 46/100 [07:57<13:14, 14.72s/it]Best trial: 44. Best value: 0.758811:  47%|████▋     | 47/100 [07:57<12:36, 14.27s/it]                                                                                      Best trial: 44. Best value: 0.758811:  47%|████▋     | 47/100 [07:58<12:36, 14.27s/it]Best trial: 44. Best value: 0.758811:  47%|████▋     | 47/100 [07:58<12:36, 14.27s/it]Best trial: 44. Best value: 0.758811:  48%|████▊     | 48/100 [07:58<09:01, 10.42s/it]                                                                                      Best trial: 44. Best value: 0.758811:  48%|████▊     | 48/100 [08:07<09:01, 10.42s/it]Best trial: 44. Best value: 0.758811:  48%|████▊     | 48/100 [08:08<09:01, 10.42s/it]Best trial: 44. Best value: 0.758811:  49%|████▉     | 49/100 [08:08<08:32, 10.05s/it]                                                                                      Best trial: 44. Best value: 0.758811:  49%|████▉     | 49/100 [08:09<08:32, 10.05s/it]Best trial: 44. Best value: 0.758811:  49%|████▉     | 49/100 [08:09<08:32, 10.05s/it]Best trial: 44. Best value: 0.758811:  50%|█████     | 50/100 [08:09<06:09,  7.39s/it]                                                                                      Best trial: 44. Best value: 0.758811:  50%|█████     | 50/100 [08:21<06:09,  7.39s/it]Best trial: 44. Best value: 0.758811:  50%|█████     | 50/100 [08:21<06:09,  7.39s/it]Best trial: 44. Best value: 0.758811:  51%|█████     | 51/100 [08:21<07:12,  8.82s/it]                                                                                      Best trial: 44. Best value: 0.758811:  51%|█████     | 51/100 [08:36<07:12,  8.82s/it]Best trial: 44. Best value: 0.758811:  51%|█████     | 51/100 [08:37<07:12,  8.82s/it]Best trial: 44. Best value: 0.758811:  52%|█████▏    | 52/100 [08:37<08:42, 10.88s/it]                                                                                      Best trial: 44. Best value: 0.758811:  52%|█████▏    | 52/100 [09:01<08:42, 10.88s/it]Best trial: 44. Best value: 0.758811:  52%|█████▏    | 52/100 [09:01<08:42, 10.88s/it]Best trial: 44. Best value: 0.758811:  53%|█████▎    | 53/100 [09:01<11:38, 14.87s/it]                                                                                      Best trial: 44. Best value: 0.758811:  53%|█████▎    | 53/100 [09:08<11:38, 14.87s/it]Best trial: 44. Best value: 0.758811:  53%|█████▎    | 53/100 [09:08<11:38, 14.87s/it]Best trial: 44. Best value: 0.758811:  54%|█████▍    | 54/100 [09:08<09:40, 12.62s/it]                                                                                      Best trial: 44. Best value: 0.758811:  54%|█████▍    | 54/100 [09:38<09:40, 12.62s/it]Best trial: 54. Best value: 0.759866:  54%|█████▍    | 54/100 [09:38<09:40, 12.62s/it]Best trial: 54. Best value: 0.759866:  55%|█████▌    | 55/100 [09:38<13:18, 17.74s/it]                                                                                      Best trial: 54. Best value: 0.759866:  55%|█████▌    | 55/100 [10:20<13:18, 17.74s/it]Best trial: 54. Best value: 0.759866:  55%|█████▌    | 55/100 [10:20<13:18, 17.74s/it]Best trial: 54. Best value: 0.759866:  56%|█████▌    | 56/100 [10:20<18:20, 25.00s/it]                                                                                      Best trial: 54. Best value: 0.759866:  56%|█████▌    | 56/100 [10:25<18:20, 25.00s/it]Best trial: 54. Best value: 0.759866:  56%|█████▌    | 56/100 [10:26<18:20, 25.00s/it]Best trial: 54. Best value: 0.759866:  57%|█████▋    | 57/100 [10:26<13:46, 19.23s/it]                                                                                      Best trial: 54. Best value: 0.759866:  57%|█████▋    | 57/100 [10:51<13:46, 19.23s/it]Best trial: 54. Best value: 0.759866:  57%|█████▋    | 57/100 [10:51<13:46, 19.23s/it]Best trial: 54. Best value: 0.759866:  58%|█████▊    | 58/100 [10:51<14:49, 21.19s/it]                                                                                      Best trial: 54. Best value: 0.759866:  58%|█████▊    | 58/100 [10:53<14:49, 21.19s/it]Best trial: 54. Best value: 0.759866:  58%|█████▊    | 58/100 [10:53<14:49, 21.19s/it]Best trial: 54. Best value: 0.759866:  59%|█████▉    | 59/100 [10:53<10:34, 15.47s/it]                                                                                      Best trial: 54. Best value: 0.759866:  59%|█████▉    | 59/100 [11:00<10:34, 15.47s/it]Best trial: 54. Best value: 0.759866:  59%|█████▉    | 59/100 [11:01<10:34, 15.47s/it]Best trial: 54. Best value: 0.759866:  60%|██████    | 60/100 [11:01<08:39, 12.99s/it]                                                                                      Best trial: 54. Best value: 0.759866:  60%|██████    | 60/100 [11:24<08:39, 12.99s/it]Best trial: 54. Best value: 0.759866:  60%|██████    | 60/100 [11:24<08:39, 12.99s/it]Best trial: 54. Best value: 0.759866:  61%|██████    | 61/100 [11:24<10:30, 16.17s/it]                                                                                      Best trial: 54. Best value: 0.759866:  61%|██████    | 61/100 [11:47<10:30, 16.17s/it]Best trial: 54. Best value: 0.759866:  61%|██████    | 61/100 [11:47<10:30, 16.17s/it]Best trial: 54. Best value: 0.759866:  62%|██████▏   | 62/100 [11:47<11:32, 18.22s/it]                                                                                      Best trial: 54. Best value: 0.759866:  62%|██████▏   | 62/100 [12:01<11:32, 18.22s/it]Best trial: 54. Best value: 0.759866:  62%|██████▏   | 62/100 [12:01<11:32, 18.22s/it]Best trial: 54. Best value: 0.759866:  63%|██████▎   | 63/100 [12:01<10:28, 17.00s/it]                                                                                      Best trial: 54. Best value: 0.759866:  63%|██████▎   | 63/100 [12:25<10:28, 17.00s/it]Best trial: 54. Best value: 0.759866:  63%|██████▎   | 63/100 [12:26<10:28, 17.00s/it]Best trial: 54. Best value: 0.759866:  64%|██████▍   | 64/100 [12:26<11:29, 19.16s/it]                                                                                      Best trial: 54. Best value: 0.759866:  64%|██████▍   | 64/100 [12:54<11:29, 19.16s/it]Best trial: 54. Best value: 0.759866:  64%|██████▍   | 64/100 [12:54<11:29, 19.16s/it]Best trial: 54. Best value: 0.759866:  65%|██████▌   | 65/100 [12:54<12:52, 22.08s/it]                                                                                      
[I 2025-12-14 17:24:35,472] Trial 33 finished with value: 0.7515247279142473 and parameters: {'learning_rate': 0.0004578331185784638, 'weight_decay': 4.395838169918651e-05, 'batch_size': 32, 'scheduler': 'cosine', 'grad_clip': 0.5, 's1_hidden_size': 64, 's1_num_layers': 2, 's1_dropout': 0.45000000000000007, 's1_bidirectional': True, 's2_hidden_size': 64, 's2_num_layers': 1, 's2_dropout': 0.2, 's2_bidirectional': False, 'use_class_weights': True, 'class_weight_scale': 0.4}. Best is trial 13 with value: 0.7578354045595219.
[I 2025-12-14 17:24:36,823] Trial 34 pruned. 
[I 2025-12-14 17:24:38,207] Trial 35 pruned. 
[I 2025-12-14 17:24:41,592] Trial 36 pruned. 
[I 2025-12-14 17:24:42,868] Trial 37 pruned. 
[I 2025-12-14 17:24:44,305] Trial 38 pruned. 
[I 2025-12-14 17:24:53,288] Trial 39 finished with value: 0.7435245590912628 and parameters: {'learning_rate': 0.0003098006969228182, 'weight_decay': 0.001930398364923821, 'batch_size': 8, 'scheduler': 'cosine', 'grad_clip': 3.0, 's1_hidden_size': 64, 's1_num_layers': 1, 's1_dropout': 0.25, 's1_bidirectional': True, 's2_hidden_size': 64, 's2_num_layers': 1, 's2_dropout': 0.4, 's2_bidirectional': False, 'use_class_weights': True, 'class_weight_scale': 0.2}. Best is trial 13 with value: 0.7578354045595219.
[I 2025-12-14 17:25:01,133] Trial 40 pruned. 
[I 2025-12-14 17:25:03,590] Trial 41 pruned. 
[I 2025-12-14 17:25:26,649] Trial 42 finished with value: 0.7474802031740865 and parameters: {'learning_rate': 0.00110770612522492, 'weight_decay': 0.0005993611400096916, 'batch_size': 32, 'scheduler': 'cosine', 'grad_clip': 2.0, 's1_hidden_size': 192, 's1_num_layers': 2, 's1_dropout': 0.5, 's1_bidirectional': True, 's2_hidden_size': 64, 's2_num_layers': 2, 's2_dropout': 0.30000000000000004, 's2_bidirectional': False, 'use_class_weights': True, 'class_weight_scale': 0.4}. Best is trial 13 with value: 0.7578354045595219.
[I 2025-12-14 17:25:28,252] Trial 43 pruned. 
[I 2025-12-14 17:26:18,544] Trial 44 finished with value: 0.7588106589168194 and parameters: {'learning_rate': 0.00043750600131660773, 'weight_decay': 0.00020003413825658804, 'batch_size': 32, 'scheduler': 'cosine', 'grad_clip': 3.0, 's1_hidden_size': 192, 's1_num_layers': 2, 's1_dropout': 0.4, 's1_bidirectional': True, 's2_hidden_size': 64, 's2_num_layers': 1, 's2_dropout': 0.2, 's2_bidirectional': False, 'use_class_weights': True, 'class_weight_scale': 0.4}. Best is trial 44 with value: 0.7588106589168194.
[I 2025-12-14 17:26:20,088] Trial 45 pruned. 
[I 2025-12-14 17:26:33,316] Trial 46 finished with value: 0.7457031553276577 and parameters: {'learning_rate': 0.0004920948462173662, 'weight_decay': 7.905608217827967e-05, 'batch_size': 8, 'scheduler': 'step', 'grad_clip': 3.0, 's1_hidden_size': 128, 's1_num_layers': 2, 's1_dropout': 0.5, 's1_bidirectional': True, 's2_hidden_size': 128, 's2_num_layers': 1, 's2_dropout': 0.1, 's2_bidirectional': False, 'use_class_weights': True, 'class_weight_scale': 0.8}. Best is trial 44 with value: 0.7588106589168194.
[I 2025-12-14 17:26:34,761] Trial 47 pruned. 
[I 2025-12-14 17:26:43,949] Trial 48 finished with value: 0.7442238959600447 and parameters: {'learning_rate': 0.0005665550553516212, 'weight_decay': 0.00020167072462522347, 'batch_size': 32, 'scheduler': 'cosine', 'grad_clip': 3.0, 's1_hidden_size': 192, 's1_num_layers': 1, 's1_dropout': 0.4, 's1_bidirectional': True, 's2_hidden_size': 64, 's2_num_layers': 1, 's2_dropout': 0.2, 's2_bidirectional': True, 'use_class_weights': True, 'class_weight_scale': 0.4}. Best is trial 44 with value: 0.7588106589168194.
[I 2025-12-14 17:26:45,125] Trial 49 pruned. 
[I 2025-12-14 17:26:57,265] Trial 50 pruned. 
[I 2025-12-14 17:27:12,948] Trial 51 finished with value: 0.7439284807984148 and parameters: {'learning_rate': 0.0009563204542153074, 'weight_decay': 0.00013342335268526394, 'batch_size': 32, 'scheduler': 'cosine', 'grad_clip': 0.5, 's1_hidden_size': 192, 's1_num_layers': 2, 's1_dropout': 0.45000000000000007, 's1_bidirectional': True, 's2_hidden_size': 64, 's2_num_layers': 2, 's2_dropout': 0.25, 's2_bidirectional': False, 'use_class_weights': True, 'class_weight_scale': 0.4}. Best is trial 44 with value: 0.7588106589168194.
[I 2025-12-14 17:27:37,068] Trial 52 finished with value: 0.7425162711298066 and parameters: {'learning_rate': 0.0007280333044458333, 'weight_decay': 0.00029438856088073154, 'batch_size': 32, 'scheduler': 'cosine', 'grad_clip': 2.0, 's1_hidden_size': 192, 's1_num_layers': 2, 's1_dropout': 0.45000000000000007, 's1_bidirectional': True, 's2_hidden_size': 64, 's2_num_layers': 2, 's2_dropout': 0.2, 's2_bidirectional': False, 'use_class_weights': True, 'class_weight_scale': 0.4}. Best is trial 44 with value: 0.7588106589168194.
[I 2025-12-14 17:27:44,491] Trial 53 pruned. 
[I 2025-12-14 17:28:14,206] Trial 54 finished with value: 0.7598659819003192 and parameters: {'learning_rate': 0.0002875554878269856, 'weight_decay': 0.00014895461441055262, 'batch_size': 32, 'scheduler': 'cosine', 'grad_clip': 0.5, 's1_hidden_size': 192, 's1_num_layers': 2, 's1_dropout': 0.5, 's1_bidirectional': True, 's2_hidden_size': 64, 's2_num_layers': 3, 's2_dropout': 0.30000000000000004, 's2_bidirectional': False, 'use_class_weights': True, 'class_weight_scale': 0.6000000000000001}. Best is trial 54 with value: 0.7598659819003192.
[I 2025-12-14 17:28:56,142] Trial 55 pruned. 
[I 2025-12-14 17:29:01,909] Trial 56 pruned. 
[I 2025-12-14 17:29:27,660] Trial 57 finished with value: 0.7512032153426288 and parameters: {'learning_rate': 0.00023052271189152233, 'weight_decay': 0.0004503961102275764, 'batch_size': 16, 'scheduler': 'cosine', 'grad_clip': 0.5, 's1_hidden_size': 192, 's1_num_layers': 2, 's1_dropout': 0.5, 's1_bidirectional': True, 's2_hidden_size': 64, 's2_num_layers': 3, 's2_dropout': 0.30000000000000004, 's2_bidirectional': False, 'use_class_weights': True, 'class_weight_scale': 0.6000000000000001}. Best is trial 54 with value: 0.7598659819003192.
[I 2025-12-14 17:29:29,785] Trial 58 pruned. 
[I 2025-12-14 17:29:36,995] Trial 59 pruned. 
[I 2025-12-14 17:30:00,591] Trial 60 finished with value: 0.7540803695811791 and parameters: {'learning_rate': 0.0002735804026278987, 'weight_decay': 0.002806293069857914, 'batch_size': 32, 'scheduler': 'cosine', 'grad_clip': 3.0, 's1_hidden_size': 192, 's1_num_layers': 2, 's1_dropout': 0.5, 's1_bidirectional': True, 's2_hidden_size': 64, 's2_num_layers': 1, 's2_dropout': 0.2, 's2_bidirectional': False, 'use_class_weights': True, 'class_weight_scale': 0.6000000000000001}. Best is trial 54 with value: 0.7598659819003192.
[I 2025-12-14 17:30:23,581] Trial 61 finished with value: 0.753145242485813 and parameters: {'learning_rate': 0.00028778131631799185, 'weight_decay': 0.005560389982811084, 'batch_size': 32, 'scheduler': 'cosine', 'grad_clip': 3.0, 's1_hidden_size': 192, 's1_num_layers': 2, 's1_dropout': 0.5, 's1_bidirectional': True, 's2_hidden_size': 64, 's2_num_layers': 1, 's2_dropout': 0.2, 's2_bidirectional': False, 'use_class_weights': True, 'class_weight_scale': 0.6000000000000001}. Best is trial 54 with value: 0.7598659819003192.
[I 2025-12-14 17:30:37,724] Trial 62 pruned. 
[I 2025-12-14 17:31:01,928] Trial 63 finished with value: 0.7532516478296947 and parameters: {'learning_rate': 0.0002039146745116817, 'weight_decay': 0.0037282809828462337, 'batch_size': 32, 'scheduler': 'cosine', 'grad_clip': 3.0, 's1_hidden_size': 192, 's1_num_layers': 2, 's1_dropout': 0.5, 's1_bidirectional': True, 's2_hidden_size': 64, 's2_num_layers': 1, 's2_dropout': 0.2, 's2_bidirectional': False, 'use_class_weights': True, 'class_weight_scale': 0.6000000000000001}. Best is trial 54 with value: 0.7598659819003192.
[I 2025-12-14 17:31:30,823] Trial 64 finished with value: 0.7537326299250142 and parameters: {'learning_rate': 0.00019885659137729717, 'weight_decay': 0.004041796164337712, 'batch_size': 32, 'scheduler': 'cosine', 'grad_clip': 3.0, 's1_hidden_size': 192, 's1_num_layers': 2, 's1_dropout': 0.5, 's1_bidirectional': True, 's2_hidden_size': 64, 's2_num_layers': 1, 's2_dropout': 0.2, 's2_bidirectional': False, 'use_class_weights': True, 'class_weight_scale': 0.6000000000000001}. Best is trial 54 with value: 0.7598659819003192.
[I 2025-12-14 17:31:55,194] Trial 65 finished with value: 0.7536136633934758 and parameters: {'learning_rate': 0.0001383879273996412, 'weight_decay': 0.0033589716581953664, 'batch_size': 32, 'scheduler': 'cosine', 'grad_clip': 3.0, 's1_hidden_size': 192, 's1_num_layers': 2, 's1_dropout': 0.5, 's1_bidirectional': True, 's2_hidden_size': 64, 's2_num_layers': 1, 's2_dropout': 0.25, 's2_bidirectional': False, 'use_class_weights': True, 'class_weight_scale': 0.6000000000000001}. Best is trial 54 with value: 0.7598659819003192.Best trial: 54. Best value: 0.759866:  65%|██████▌   | 65/100 [13:19<12:52, 22.08s/it]Best trial: 54. Best value: 0.759866:  65%|██████▌   | 65/100 [13:19<12:52, 22.08s/it]Best trial: 54. Best value: 0.759866:  66%|██████▌   | 66/100 [13:19<12:53, 22.76s/it]                                                                                      Best trial: 54. Best value: 0.759866:  66%|██████▌   | 66/100 [13:37<12:53, 22.76s/it]Best trial: 54. Best value: 0.759866:  66%|██████▌   | 66/100 [13:38<12:53, 22.76s/it]Best trial: 54. Best value: 0.759866:  67%|██████▋   | 67/100 [13:38<11:52, 21.58s/it]                                                                                      Best trial: 54. Best value: 0.759866:  67%|██████▋   | 67/100 [13:45<11:52, 21.58s/it]Best trial: 54. Best value: 0.759866:  67%|██████▋   | 67/100 [13:45<11:52, 21.58s/it]Best trial: 54. Best value: 0.759866:  68%|██████▊   | 68/100 [13:45<09:13, 17.29s/it]                                                                                      Best trial: 54. Best value: 0.759866:  68%|██████▊   | 68/100 [13:49<09:13, 17.29s/it]Best trial: 54. Best value: 0.759866:  68%|██████▊   | 68/100 [13:49<09:13, 17.29s/it]Best trial: 54. Best value: 0.759866:  69%|██████▉   | 69/100 [13:49<06:51, 13.27s/it]                                                                                      Best trial: 54. Best value: 0.759866:  69%|██████▉   | 69/100 [14:02<06:51, 13.27s/it]Best trial: 54. Best value: 0.759866:  69%|██████▉   | 69/100 [14:02<06:51, 13.27s/it]Best trial: 54. Best value: 0.759866:  70%|███████   | 70/100 [14:02<06:38, 13.29s/it]                                                                                      Best trial: 54. Best value: 0.759866:  70%|███████   | 70/100 [14:51<06:38, 13.29s/it]Best trial: 54. Best value: 0.759866:  70%|███████   | 70/100 [14:51<06:38, 13.29s/it]Best trial: 54. Best value: 0.759866:  71%|███████   | 71/100 [14:51<11:36, 24.02s/it]                                                                                      Best trial: 54. Best value: 0.759866:  71%|███████   | 71/100 [15:29<11:36, 24.02s/it]Best trial: 54. Best value: 0.759866:  71%|███████   | 71/100 [15:29<11:36, 24.02s/it]Best trial: 54. Best value: 0.759866:  72%|███████▏  | 72/100 [15:29<13:06, 28.07s/it]                                                                                      Best trial: 54. Best value: 0.759866:  72%|███████▏  | 72/100 [15:58<13:06, 28.07s/it]Best trial: 54. Best value: 0.759866:  72%|███████▏  | 72/100 [15:58<13:06, 28.07s/it]Best trial: 54. Best value: 0.759866:  73%|███████▎  | 73/100 [15:58<12:47, 28.42s/it]                                                                                      Best trial: 54. Best value: 0.759866:  73%|███████▎  | 73/100 [16:05<12:47, 28.42s/it]Best trial: 54. Best value: 0.759866:  73%|███████▎  | 73/100 [16:05<12:47, 28.42s/it]Best trial: 54. Best value: 0.759866:  74%|███████▍  | 74/100 [16:05<09:34, 22.11s/it]                                                                                      Best trial: 54. Best value: 0.759866:  74%|███████▍  | 74/100 [16:12<09:34, 22.11s/it]Best trial: 54. Best value: 0.759866:  74%|███████▍  | 74/100 [16:13<09:34, 22.11s/it]Best trial: 54. Best value: 0.759866:  75%|███████▌  | 75/100 [16:13<07:21, 17.67s/it]                                                                                      Best trial: 54. Best value: 0.759866:  75%|███████▌  | 75/100 [16:42<07:21, 17.67s/it]Best trial: 54. Best value: 0.759866:  75%|███████▌  | 75/100 [16:42<07:21, 17.67s/it]Best trial: 54. Best value: 0.759866:  76%|███████▌  | 76/100 [16:42<08:27, 21.14s/it]                                                                                      Best trial: 54. Best value: 0.759866:  76%|███████▌  | 76/100 [17:23<08:27, 21.14s/it]Best trial: 54. Best value: 0.759866:  76%|███████▌  | 76/100 [17:23<08:27, 21.14s/it]Best trial: 54. Best value: 0.759866:  77%|███████▋  | 77/100 [17:23<10:23, 27.11s/it]                                                                                      Best trial: 54. Best value: 0.759866:  77%|███████▋  | 77/100 [17:47<10:23, 27.11s/it]Best trial: 54. Best value: 0.759866:  77%|███████▋  | 77/100 [17:47<10:23, 27.11s/it]Best trial: 54. Best value: 0.759866:  78%|███████▊  | 78/100 [17:47<09:34, 26.13s/it]                                                                                      Best trial: 54. Best value: 0.759866:  78%|███████▊  | 78/100 [17:54<09:34, 26.13s/it]Best trial: 54. Best value: 0.759866:  78%|███████▊  | 78/100 [17:54<09:34, 26.13s/it]Best trial: 54. Best value: 0.759866:  79%|███████▉  | 79/100 [17:54<07:09, 20.44s/it]                                                                                      Best trial: 54. Best value: 0.759866:  79%|███████▉  | 79/100 [17:56<07:09, 20.44s/it]Best trial: 54. Best value: 0.759866:  79%|███████▉  | 79/100 [17:56<07:09, 20.44s/it]Best trial: 54. Best value: 0.759866:  80%|████████  | 80/100 [17:56<04:57, 14.86s/it]                                                                                      Best trial: 54. Best value: 0.759866:  80%|████████  | 80/100 [18:04<04:57, 14.86s/it]Best trial: 54. Best value: 0.759866:  80%|████████  | 80/100 [18:04<04:57, 14.86s/it]Best trial: 54. Best value: 0.759866:  81%|████████  | 81/100 [18:04<04:05, 12.92s/it]                                                                                      Best trial: 54. Best value: 0.759866:  81%|████████  | 81/100 [18:11<04:05, 12.92s/it]Best trial: 54. Best value: 0.759866:  81%|████████  | 81/100 [18:11<04:05, 12.92s/it]Best trial: 54. Best value: 0.759866:  82%|████████▏ | 82/100 [18:11<03:21, 11.21s/it]                                                                                      Best trial: 54. Best value: 0.759866:  82%|████████▏ | 82/100 [18:36<03:21, 11.21s/it]Best trial: 54. Best value: 0.759866:  82%|████████▏ | 82/100 [18:36<03:21, 11.21s/it]Best trial: 54. Best value: 0.759866:  83%|████████▎ | 83/100 [18:36<04:21, 15.37s/it]                                                                                      Best trial: 54. Best value: 0.759866:  83%|████████▎ | 83/100 [18:59<04:21, 15.37s/it]Best trial: 54. Best value: 0.759866:  83%|████████▎ | 83/100 [19:00<04:21, 15.37s/it]Best trial: 54. Best value: 0.759866:  84%|████████▍ | 84/100 [19:00<04:43, 17.70s/it]                                                                                      Best trial: 54. Best value: 0.759866:  84%|████████▍ | 84/100 [19:07<04:43, 17.70s/it]Best trial: 54. Best value: 0.759866:  84%|████████▍ | 84/100 [19:07<04:43, 17.70s/it]Best trial: 54. Best value: 0.759866:  85%|████████▌ | 85/100 [19:07<03:38, 14.59s/it]                                                                                      Best trial: 54. Best value: 0.759866:  85%|████████▌ | 85/100 [19:42<03:38, 14.59s/it]Best trial: 54. Best value: 0.759866:  85%|████████▌ | 85/100 [19:42<03:38, 14.59s/it]Best trial: 54. Best value: 0.759866:  86%|████████▌ | 86/100 [19:42<04:51, 20.81s/it]                                                                                      Best trial: 54. Best value: 0.759866:  86%|████████▌ | 86/100 [19:54<04:51, 20.81s/it]Best trial: 54. Best value: 0.759866:  86%|████████▌ | 86/100 [19:55<04:51, 20.81s/it]Best trial: 54. Best value: 0.759866:  87%|████████▋ | 87/100 [19:55<03:57, 18.28s/it]                                                                                      Best trial: 54. Best value: 0.759866:  87%|████████▋ | 87/100 [20:04<03:57, 18.28s/it]Best trial: 54. Best value: 0.759866:  87%|████████▋ | 87/100 [20:04<03:57, 18.28s/it]Best trial: 54. Best value: 0.759866:  88%|████████▊ | 88/100 [20:04<03:07, 15.61s/it]                                                                                      Best trial: 54. Best value: 0.759866:  88%|████████▊ | 88/100 [20:22<03:07, 15.61s/it]Best trial: 54. Best value: 0.759866:  88%|████████▊ | 88/100 [20:22<03:07, 15.61s/it]Best trial: 54. Best value: 0.759866:  89%|████████▉ | 89/100 [20:22<03:01, 16.46s/it]                                                                                      Best trial: 54. Best value: 0.759866:  89%|████████▉ | 89/100 [20:45<03:01, 16.46s/it]Best trial: 54. Best value: 0.759866:  89%|████████▉ | 89/100 [20:45<03:01, 16.46s/it]Best trial: 54. Best value: 0.759866:  90%|█████████ | 90/100 [20:45<03:03, 18.33s/it]                                                                                      Best trial: 54. Best value: 0.759866:  90%|█████████ | 90/100 [20:47<03:03, 18.33s/it]Best trial: 54. Best value: 0.759866:  90%|█████████ | 90/100 [20:47<03:03, 18.33s/it]Best trial: 54. Best value: 0.759866:  91%|█████████ | 91/100 [20:47<02:00, 13.37s/it]                                                                                      Best trial: 54. Best value: 0.759866:  91%|█████████ | 91/100 [21:22<02:00, 13.37s/it]Best trial: 54. Best value: 0.759866:  91%|█████████ | 91/100 [21:22<02:00, 13.37s/it]Best trial: 54. Best value: 0.759866:  92%|█████████▏| 92/100 [21:22<02:39, 19.89s/it]                                                                                      Best trial: 54. Best value: 0.759866:  92%|█████████▏| 92/100 [21:55<02:39, 19.89s/it]Best trial: 54. Best value: 0.759866:  92%|█████████▏| 92/100 [21:55<02:39, 19.89s/it]Best trial: 54. Best value: 0.759866:  93%|█████████▎| 93/100 [21:55<02:47, 23.89s/it]                                                                                      Best trial: 54. Best value: 0.759866:  93%|█████████▎| 93/100 [22:02<02:47, 23.89s/it]Best trial: 54. Best value: 0.759866:  93%|█████████▎| 93/100 [22:03<02:47, 23.89s/it]Best trial: 54. Best value: 0.759866:  94%|█████████▍| 94/100 [22:03<01:53, 18.93s/it]                                                                                      
[I 2025-12-14 17:32:14,003] Trial 66 finished with value: 0.7537510064101206 and parameters: {'learning_rate': 7.89692435356078e-05, 'weight_decay': 0.0029848738545144166, 'batch_size': 32, 'scheduler': 'cosine', 'grad_clip': 3.0, 's1_hidden_size': 192, 's1_num_layers': 2, 's1_dropout': 0.5, 's1_bidirectional': True, 's2_hidden_size': 64, 's2_num_layers': 2, 's2_dropout': 0.25, 's2_bidirectional': False, 'use_class_weights': True, 'class_weight_scale': 0.6000000000000001}. Best is trial 54 with value: 0.7598659819003192.
[I 2025-12-14 17:32:21,295] Trial 67 pruned. 
[I 2025-12-14 17:32:25,142] Trial 68 pruned. 
[I 2025-12-14 17:32:38,489] Trial 69 finished with value: 0.7408100550325233 and parameters: {'learning_rate': 7.727033098289338e-05, 'weight_decay': 0.004769151819458075, 'batch_size': 16, 'scheduler': 'one_cycle', 'grad_clip': 3.0, 's1_hidden_size': 192, 's1_num_layers': 2, 's1_dropout': 0.5, 's1_bidirectional': False, 's2_hidden_size': 64, 's2_num_layers': 2, 's2_dropout': 0.30000000000000004, 's2_bidirectional': False, 'use_class_weights': True, 'class_weight_scale': 0.6000000000000001}. Best is trial 54 with value: 0.7598659819003192.
[I 2025-12-14 17:33:27,524] Trial 70 finished with value: 0.7513258872055317 and parameters: {'learning_rate': 0.0003587405114132421, 'weight_decay': 0.002200603778815134, 'batch_size': 32, 'scheduler': 'step', 'grad_clip': 3.0, 's1_hidden_size': 192, 's1_num_layers': 3, 's1_dropout': 0.45000000000000007, 's1_bidirectional': True, 's2_hidden_size': 64, 's2_num_layers': 2, 's2_dropout': 0.25, 's2_bidirectional': True, 'use_class_weights': True, 'class_weight_scale': 0.6000000000000001}. Best is trial 54 with value: 0.7598659819003192.
[I 2025-12-14 17:34:05,062] Trial 71 finished with value: 0.7541300051509088 and parameters: {'learning_rate': 0.00013717709286507917, 'weight_decay': 0.004138407387823025, 'batch_size': 32, 'scheduler': 'cosine', 'grad_clip': 3.0, 's1_hidden_size': 192, 's1_num_layers': 2, 's1_dropout': 0.5, 's1_bidirectional': True, 's2_hidden_size': 64, 's2_num_layers': 2, 's2_dropout': 0.25, 's2_bidirectional': False, 'use_class_weights': True, 'class_weight_scale': 0.6000000000000001}. Best is trial 54 with value: 0.7598659819003192.
[I 2025-12-14 17:34:34,331] Trial 72 finished with value: 0.7518632717923456 and parameters: {'learning_rate': 0.00010967721198756361, 'weight_decay': 0.008815891453344993, 'batch_size': 32, 'scheduler': 'cosine', 'grad_clip': 3.0, 's1_hidden_size': 192, 's1_num_layers': 2, 's1_dropout': 0.5, 's1_bidirectional': True, 's2_hidden_size': 64, 's2_num_layers': 2, 's2_dropout': 0.25, 's2_bidirectional': False, 'use_class_weights': True, 'class_weight_scale': 0.6000000000000001}. Best is trial 54 with value: 0.7598659819003192.
[I 2025-12-14 17:34:41,699] Trial 73 pruned. 
[I 2025-12-14 17:34:49,015] Trial 74 pruned. 
[I 2025-12-14 17:35:18,268] Trial 75 finished with value: 0.7550359155147487 and parameters: {'learning_rate': 0.000149939574989589, 'weight_decay': 0.002485872475936998, 'batch_size': 32, 'scheduler': 'cosine', 'grad_clip': 3.0, 's1_hidden_size': 192, 's1_num_layers': 2, 's1_dropout': 0.5, 's1_bidirectional': True, 's2_hidden_size': 64, 's2_num_layers': 2, 's2_dropout': 0.2, 's2_bidirectional': False, 'use_class_weights': True, 'class_weight_scale': 0.6000000000000001}. Best is trial 54 with value: 0.7598659819003192.
[I 2025-12-14 17:35:59,236] Trial 76 pruned. 
[I 2025-12-14 17:36:23,132] Trial 77 finished with value: 0.752247921933811 and parameters: {'learning_rate': 0.0002447668898172731, 'weight_decay': 0.001789140329792666, 'batch_size': 32, 'scheduler': 'cosine', 'grad_clip': 3.0, 's1_hidden_size': 192, 's1_num_layers': 2, 's1_dropout': 0.5, 's1_bidirectional': True, 's2_hidden_size': 64, 's2_num_layers': 2, 's2_dropout': 0.35, 's2_bidirectional': False, 'use_class_weights': True, 'class_weight_scale': 0.8}. Best is trial 54 with value: 0.7598659819003192.
[I 2025-12-14 17:36:30,288] Trial 78 pruned. 
[I 2025-12-14 17:36:32,102] Trial 79 pruned. 
[I 2025-12-14 17:36:40,527] Trial 80 finished with value: 0.748132052955436 and parameters: {'learning_rate': 0.00012627728659831753, 'weight_decay': 0.0009941958280183544, 'batch_size': 32, 'scheduler': 'cosine', 'grad_clip': 3.0, 's1_hidden_size': 192, 's1_num_layers': 1, 's1_dropout': 0.2, 's1_bidirectional': False, 's2_hidden_size': 96, 's2_num_layers': 2, 's2_dropout': 0.25, 's2_bidirectional': False, 'use_class_weights': True, 'class_weight_scale': 0.6000000000000001}. Best is trial 54 with value: 0.7598659819003192.
[I 2025-12-14 17:36:47,749] Trial 81 pruned. 
[I 2025-12-14 17:37:12,836] Trial 82 finished with value: 0.7595143330079128 and parameters: {'learning_rate': 0.00033197395518304963, 'weight_decay': 0.003939607309032114, 'batch_size': 32, 'scheduler': 'cosine', 'grad_clip': 3.0, 's1_hidden_size': 192, 's1_num_layers': 2, 's1_dropout': 0.5, 's1_bidirectional': True, 's2_hidden_size': 64, 's2_num_layers': 2, 's2_dropout': 0.2, 's2_bidirectional': False, 'use_class_weights': True, 'class_weight_scale': 0.6000000000000001}. Best is trial 54 with value: 0.7598659819003192.
[I 2025-12-14 17:37:35,972] Trial 83 finished with value: 0.7498593123213444 and parameters: {'learning_rate': 0.000337158408736154, 'weight_decay': 0.0028725219031135343, 'batch_size': 32, 'scheduler': 'cosine', 'grad_clip': 3.0, 's1_hidden_size': 192, 's1_num_layers': 2, 's1_dropout': 0.5, 's1_bidirectional': True, 's2_hidden_size': 64, 's2_num_layers': 2, 's2_dropout': 0.2, 's2_bidirectional': False, 'use_class_weights': True, 'class_weight_scale': 0.6000000000000001}. Best is trial 54 with value: 0.7598659819003192.
[I 2025-12-14 17:37:43,287] Trial 84 pruned. 
[I 2025-12-14 17:38:18,613] Trial 85 finished with value: 0.7534303240270757 and parameters: {'learning_rate': 0.0002280002641257722, 'weight_decay': 0.0017033684122591548, 'batch_size': 32, 'scheduler': 'cosine', 'grad_clip': 3.0, 's1_hidden_size': 192, 's1_num_layers': 2, 's1_dropout': 0.5, 's1_bidirectional': True, 's2_hidden_size': 64, 's2_num_layers': 2, 's2_dropout': 0.25, 's2_bidirectional': False, 'use_class_weights': True, 'class_weight_scale': 0.6000000000000001}. Best is trial 54 with value: 0.7598659819003192.
[I 2025-12-14 17:38:31,015] Trial 86 finished with value: 0.7459972810528018 and parameters: {'learning_rate': 0.00043001149383721727, 'weight_decay': 9.607159875223442e-05, 'batch_size': 32, 'scheduler': 'cosine', 'grad_clip': 2.0, 's1_hidden_size': 192, 's1_num_layers': 2, 's1_dropout': 0.45000000000000007, 's1_bidirectional': True, 's2_hidden_size': 64, 's2_num_layers': 2, 's2_dropout': 0.25, 's2_bidirectional': False, 'use_class_weights': True, 'class_weight_scale': 0.6000000000000001}. Best is trial 54 with value: 0.7598659819003192.
[I 2025-12-14 17:38:40,375] Trial 87 pruned. 
[I 2025-12-14 17:38:58,814] Trial 88 finished with value: 0.7566404273753448 and parameters: {'learning_rate': 0.0002607042474822344, 'weight_decay': 1.0419747860808653e-06, 'batch_size': 32, 'scheduler': 'cosine', 'grad_clip': 1.0, 's1_hidden_size': 192, 's1_num_layers': 2, 's1_dropout': 0.5, 's1_bidirectional': True, 's2_hidden_size': 64, 's2_num_layers': 3, 's2_dropout': 0.2, 's2_bidirectional': False, 'use_class_weights': True, 'class_weight_scale': 0.4}. Best is trial 54 with value: 0.7598659819003192.
[I 2025-12-14 17:39:21,514] Trial 89 pruned. 
[I 2025-12-14 17:39:23,324] Trial 90 pruned. 
[I 2025-12-14 17:39:58,410] Trial 91 pruned. 
[I 2025-12-14 17:40:31,651] Trial 92 finished with value: 0.7563283888593002 and parameters: {'learning_rate': 0.0002487082197324841, 'weight_decay': 0.0007225650835501995, 'batch_size': 32, 'scheduler': 'cosine', 'grad_clip': 1.0, 's1_hidden_size': 192, 's1_num_layers': 2, 's1_dropout': 0.5, 's1_bidirectional': True, 's2_hidden_size': 64, 's2_num_layers': 3, 's2_dropout': 0.30000000000000004, 's2_bidirectional': False, 'use_class_weights': True, 'class_weight_scale': 0.6000000000000001}. Best is trial 54 with value: 0.7598659819003192.
[I 2025-12-14 17:40:38,993] Trial 93 pruned. 
[I 2025-12-14 17:40:55,421] Trial 94 finished with value: 0.7473739084071482 and parameters: {'learning_rate': 0.00027405096506149206, 'weight_decay': 3.292133848075949e-06, 'batch_size': 32, 'scheduler': 'cosine', 'grad_clip': 1.0, 's1_hidden_size': 192, 's1_num_layers': 2, 's1_dropout': 0.5, 's1_bidirectional': True, 's2_hidden_size': 64, 's2_num_layers': 3, 's2_dropout': 0.30000000000000004, 's2_bidirectional': False, 'use_class_weights': True, 'class_weight_scale': 0.4}. Best is trial 54 with value: 0.7598659819003192.Best trial: 54. Best value: 0.759866:  94%|█████████▍| 94/100 [22:19<01:53, 18.93s/it]Best trial: 54. Best value: 0.759866:  94%|█████████▍| 94/100 [22:19<01:53, 18.93s/it]Best trial: 54. Best value: 0.759866:  95%|█████████▌| 95/100 [22:19<01:30, 18.18s/it]                                                                                      Best trial: 54. Best value: 0.759866:  95%|█████████▌| 95/100 [22:35<01:30, 18.18s/it]Best trial: 54. Best value: 0.759866:  95%|█████████▌| 95/100 [22:36<01:30, 18.18s/it]Best trial: 54. Best value: 0.759866:  96%|█████████▌| 96/100 [22:36<01:10, 17.67s/it]                                                                                      Best trial: 54. Best value: 0.759866:  96%|█████████▌| 96/100 [22:56<01:10, 17.67s/it]Best trial: 54. Best value: 0.759866:  96%|█████████▌| 96/100 [22:56<01:10, 17.67s/it]Best trial: 54. Best value: 0.759866:  97%|█████████▋| 97/100 [22:56<00:55, 18.49s/it]                                                                                      Best trial: 54. Best value: 0.759866:  97%|█████████▋| 97/100 [22:57<00:55, 18.49s/it]Best trial: 54. Best value: 0.759866:  97%|█████████▋| 97/100 [22:57<00:55, 18.49s/it]Best trial: 54. Best value: 0.759866:  98%|█████████▊| 98/100 [22:57<00:26, 13.37s/it]                                                                                      Best trial: 54. Best value: 0.759866:  98%|█████████▊| 98/100 [23:23<00:26, 13.37s/it]Best trial: 54. Best value: 0.759866:  98%|█████████▊| 98/100 [23:23<00:26, 13.37s/it]Best trial: 54. Best value: 0.759866:  99%|█████████▉| 99/100 [23:23<00:17, 17.07s/it]                                                                                      Best trial: 54. Best value: 0.759866:  99%|█████████▉| 99/100 [23:37<00:17, 17.07s/it]Best trial: 54. Best value: 0.759866:  99%|█████████▉| 99/100 [23:38<00:17, 17.07s/it]Best trial: 54. Best value: 0.759866: 100%|██████████| 100/100 [23:38<00:00, 16.30s/it]Best trial: 54. Best value: 0.759866: 100%|██████████| 100/100 [23:38<00:00, 14.18s/it]
2025-12-14 17:42:14 | INFO     | 
============================================================
2025-12-14 17:42:14 | INFO     | OPTIMIZATION COMPLETE
2025-12-14 17:42:14 | INFO     | ============================================================
2025-12-14 17:42:14 | INFO     | Best trial: 54
2025-12-14 17:42:14 | INFO     | Best validation F1: 0.7599
2025-12-14 17:42:14 | INFO     | Best parameters:
2025-12-14 17:42:14 | INFO     |   learning_rate: 0.0002875554878269856
2025-12-14 17:42:14 | INFO     |   weight_decay: 0.00014895461441055262
2025-12-14 17:42:14 | INFO     |   batch_size: 32
2025-12-14 17:42:14 | INFO     |   scheduler: cosine
2025-12-14 17:42:14 | INFO     |   grad_clip: 0.5
2025-12-14 17:42:14 | INFO     |   s1_hidden_size: 192
2025-12-14 17:42:14 | INFO     |   s1_num_layers: 2
2025-12-14 17:42:14 | INFO     |   s1_dropout: 0.5
2025-12-14 17:42:14 | INFO     |   s1_bidirectional: True
2025-12-14 17:42:14 | INFO     |   s2_hidden_size: 64
2025-12-14 17:42:14 | INFO     |   s2_num_layers: 3
2025-12-14 17:42:14 | INFO     |   s2_dropout: 0.30000000000000004
2025-12-14 17:42:14 | INFO     |   s2_bidirectional: False
2025-12-14 17:42:14 | INFO     |   use_class_weights: True
2025-12-14 17:42:14 | INFO     |   class_weight_scale: 0.6000000000000001
2025-12-14 17:42:14 | INFO     | 
============================================================
2025-12-14 17:42:14 | INFO     | Training final model with best parameters...
2025-12-14 17:42:14 | INFO     | ============================================================
2025-12-14 17:43:02 | INFO     | 
Test Results:
2025-12-14 17:43:02 | INFO     |   Test F1: 0.6437
2025-12-14 17:43:02 | INFO     |   Test Accuracy: 0.6806
2025-12-14 17:43:02 | INFO     |   Detection Rate: 0.5221
2025-12-14 17:43:02 | INFO     |   False Alarm Rate: 0.0646
2025-12-14 17:43:02 | INFO     | 
Model saved to: models/hierarchical_v1b/
2025-12-14 17:43:02 | INFO     | 
Results saved to: models/hierarchical_bayesian_20251214_174302.json

[I 2025-12-14 17:41:11,925] Trial 95 finished with value: 0.7514134642911512 and parameters: {'learning_rate': 0.0003701005631347942, 'weight_decay': 0.0006126323025537407, 'batch_size': 32, 'scheduler': 'cosine', 'grad_clip': 1.0, 's1_hidden_size': 192, 's1_num_layers': 2, 's1_dropout': 0.45000000000000007, 's1_bidirectional': True, 's2_hidden_size': 64, 's2_num_layers': 3, 's2_dropout': 0.35, 's2_bidirectional': False, 'use_class_weights': True, 'class_weight_scale': 0.2}. Best is trial 54 with value: 0.7598659819003192.
[I 2025-12-14 17:41:32,306] Trial 96 finished with value: 0.7468919026369362 and parameters: {'learning_rate': 0.00031463921750921265, 'weight_decay': 0.0012132701521771236, 'batch_size': 32, 'scheduler': 'cosine', 'grad_clip': 1.0, 's1_hidden_size': 192, 's1_num_layers': 2, 's1_dropout': 0.5, 's1_bidirectional': True, 's2_hidden_size': 64, 's2_num_layers': 3, 's2_dropout': 0.15000000000000002, 's2_bidirectional': False, 'use_class_weights': False}. Best is trial 54 with value: 0.7598659819003192.
[I 2025-12-14 17:41:33,746] Trial 97 pruned. 
[I 2025-12-14 17:41:59,438] Trial 98 finished with value: 0.7482917897512494 and parameters: {'learning_rate': 0.00019022227104156626, 'weight_decay': 0.0003287058997372789, 'batch_size': 32, 'scheduler': 'cosine', 'grad_clip': 2.0, 's1_hidden_size': 192, 's1_num_layers': 2, 's1_dropout': 0.45000000000000007, 's1_bidirectional': True, 's2_hidden_size': 96, 's2_num_layers': 3, 's2_dropout': 0.2, 's2_bidirectional': False, 'use_class_weights': True, 'class_weight_scale': 0.6000000000000001}. Best is trial 54 with value: 0.7598659819003192.
[I 2025-12-14 17:42:13,929] Trial 99 pruned. 
